[
  {
    "title": "Project Main Source File",
    "path": "${workspaceFolder}/src/extension.ts",
    "line": 12,
    "group": "Source",
    "tags": ["core", "extension"]
  },
  {
    "title": "README Documentation",
    "path": "${workspaceFolder}/README.md",
    "group": "Documentation",
    "tags": ["reference"]
  }
]
